{
  "schemaVersion": 1,
  "protocolVersion": 1,
  "executionId": "exec-catalog-lint",
  "taskId": "TASK-001",
  "checkId": "lint",
  "requirement": "Lint passes on changed files",
  "verificationCycle": 1,
  "kind": "COMMAND_EXECUTION",
  "executionKind": "VERIFICATION",
  "argv": [
    "npx",
    "eslint",
    "src/catalog.ts"
  ],
  "protocolProjectRoot": "/workspace/forgeshop",
  "cwd": "/workspace/forgeshop",
  "executionIsolation": "NATIVE_PROJECT",
  "isolation": {
    "mode": "NATIVE_PROJECT",
    "isolated": false,
    "liveProjectWritable": true,
    "networkPolicy": "INHERITED",
    "environmentPolicy": "INHERITED"
  },
  "resolution": {
    "resolutionMode": "direct",
    "mayInstall": false,
    "installer": null,
    "tool": null
  },
  "startedAt": "2026-08-03T09:41:00.000Z",
  "finishedAt": "2026-08-03T09:42:00.000Z",
  "durationMs": 42000,
  "termination": "exit",
  "signal": null,
  "stdoutSha256": "f7516c7b4576441a9b623a6a289d5b8c86bdc4aff221c806d6cf0d94a85eade2",
  "stderrSha256": "f092bf6f3214796f688bc44f1503146ac9813ba82ddad263c3c422e798f3a015",
  "status": "passed",
  "exitCode": 0
}
