{
  "schemaVersion": 1,
  "protocolVersion": 1,
  "executionId": "exec-secret-scan",
  "taskId": "TASK-006",
  "checkId": "secret-scan",
  "requirement": "No secrets committed in checkout flow",
  "verificationCycle": 1,
  "kind": "COMMAND_EXECUTION",
  "executionKind": "VERIFICATION",
  "argv": [
    "node",
    "tests/secret-scan.mjs"
  ],
  "protocolProjectRoot": "/workspace/forgeshop",
  "cwd": "/workspace/forgeshop",
  "executionIsolation": "NATIVE_PROJECT",
  "isolation": {
    "mode": "NATIVE_PROJECT",
    "isolated": false,
    "liveProjectWritable": true,
    "networkPolicy": "INHERITED",
    "environmentPolicy": "INHERITED"
  },
  "resolution": {
    "resolutionMode": "direct",
    "mayInstall": false,
    "installer": null,
    "tool": null
  },
  "startedAt": "2026-08-07T14:43:00.000Z",
  "finishedAt": "2026-08-07T14:45:00.000Z",
  "durationMs": 42000,
  "termination": "exit",
  "signal": null,
  "stdoutSha256": "481083d448bcb6096e32727cd225babf1ed10278a9d7792c1110d2074fa9a314",
  "stderrSha256": "15934132f0d0bdce581ed43bdee0d407aefde5332b484802ed6d6ed44f5b62ca",
  "status": "passed",
  "exitCode": 0
}
